,Unnamed: 0,title,publication date,subject,journal,DOI,author,abstract,from_database,tfidf_score
771,1728,The social patterning of autism diagnoses reversed in California between 1992 and 2018.,2020-11-16 00:00:00,,Proceedings of the National Academy of Sciences of the United States of America,10.1073/pnas.2015762117,,"As rates of autism diagnosis increased dramatically over the past number of decades, prevalence rates were generally highest among Whites and among those of higher socioeconomic status (SES). Using a unique, population-level dataset, we find that rates of autism diagnosis continued to be on the rise in recent years, but who is diagnosed changed during the study period. Our data consist of birth records of all 13,272,573 children born in the state of California in 1992 through 2016 linked to autism caseload records for January 1992 through November 2019 from California's Department of Developmental Services. California's diagnosed autism incidence rate rose from 0.49 per 1,000 3-6 y olds in 1998 to 3.49 per 1,000 3-6 y olds in 2018, a 612% increase. However, diagnosed incidence rates did not rise uniformly across sociodemographic groups. By 2018, children of Black and Asian mothers were diagnosed at higher rates than children of non-Hispanic White mothers. Furthermore, among children of non-Hispanic White and Asian mothers, children of lower SES were diagnosed at higher rates than children of higher SES. These changes align with sociological theories of health disparities and contain important clues for more fully understanding the autism epidemic.",pubmed,0.5077441797162991
993,1987,DAS-II Cognitive Profiles Are Not Diagnostically Meaningful For Autism: A ROC Analysis.,2020-07-21 00:00:00,,Autism research : official journal of the International Society for Autism Research,10.1002/aur.2336,,"Intelligence assessment is an integral part of a comprehensive autism evaluation. Many past studies have described a cognitive profile of autistic individuals characterized by higher nonverbal than verbal IQ scores. The diagnostic utility of this profile, however, remains unknown. We leveraged receiver operating characteristic methods to determine the sensitivity, specificity, and area under the curve (AUC) of three different IQ profiles in a large sample of children who have an autism spectrum disorder diagnosis (N = 1,228, Simons Simplex Collection) who completed the Differential Ability Scales-Second Edition (DAS-II), School Age compared to the normative sample provided by the DAS-II publisher (N = 2,200). The frequently discussed nonverbal > verbal IQ profile performed near chance at distinguishing ASD from normative individuals (AUC: 0.54, 95% CI [0.52-0.56]), and performed significantly worse for females than males (AUC: females: 0.46 [0.41-0.52]; males: 0.55 [0.53-0.58]). All cognitive profiles showed AUC < 0.56. We conclude that while significant differences between verbal and nonverbal IQ scores exist at the group level, these differences are small in an absolute sense and not meaningful at an individual level. We do not recommend using cognitive profiles to aid in autism diagnostic decision-making. LAY SUMMARY: Some researchers and clinicians have reported an ""autistic cognitive profile"" of higher nonverbal intelligence than verbal intelligence. In an analysis of over 1,000 autistic children, we found that the group's average nonverbal intelligence is usually higher than their verbal intelligence. However, this pattern should not be used by clinicians to make an individual diagnosis of autism because our results show it is not helpful nor accurate.",pubmed,0.5072118004870169
98,810,Stress and distress in New Zealand parents caring for a child with autism spectrum disorder,,Developmental and Educational Psychology,,10.1016/j.ridd.2021.103875,"{'given': 'Daniel', 'family': 'Shepherd', 'sequence': 'first', 'affiliation': []}",,crossref,0.5068531659411438
674,1617,Coaching While Waiting for Autism Spectrum Disorder Assessment: Protocol of a Pilot Feasibility Study for a Randomized Controlled Trial on Occupational Performance Coaching and Service Navigation Support.,2021-01-07 00:00:00,,JMIR research protocols,10.2196/20011,,"In Australia, the average time between a first concern of autism spectrum disorder (ASD) and diagnosis is over 2 years. After referral for assessment, families often wait 6-12 months before their appointment. This can be a time of uncertainty and stress for families. For some families, other forms of assistance are not accessible and thus timely intervention opportunities are missed. There is little evidence about how to provide the best support for children or caregivers while on assessment waiting lists.",pubmed,0.5064452544889728
327,1218,Influence of Neighborhood Environment on Physical Activity Participation among Children with Autism Spectrum Disorder.,2020-11-24 00:00:00,,Autism research : official journal of the International Society for Autism Research,10.1002/aur.2445,,"Despite the positive influence of environmental factors on physical activity (PA) levels of children, further investigation is necessary when considering the unique characteristics of children with autism spectrum disorder (ASD). The purpose of this study was to examine the relationship between neighborhood environment factors and PA among children with ASD by examining the extent to which (a) the built environment, (b) neighborhood safety, and (c) neighborhood support contributes to PA. A secondary data analysis using the 2016 and 2017 combined dataset of the National Survey of Children's Health was used. The total sample included 14,944 children between the ages of 6-17 years; of this, a sample of 494 children had a parent-reported diagnosis of ASD. Multivariate logistic regressions were conducted to explore the unique influences of the above three neighborhood environment factors on PA engagement. Among children with and without ASD, an association was found between feeling safe and engaging in PA, that is, the odds of engaging in PA are greater among children who were safe in their neighborhoods than children who were not in safe neighborhoods. Surprisingly, other neighborhood factors do not have a significant relationship with PA participation among children with ASD at this time. Future studies should consider how to incorporate the support of others and feeling of safety into the neighborhood along with how to improve accessibility of the built environment in order to increase PA for children with ASD. LAY SUMMARY: The results of this study showed that neighborhood factors influence physical activity (PA) among children with ASD differently compared to their peers without ASD. Children with ASD who live in safe neighborhoods are more likely to engage in PA, while other neighborhood factors, such as playgrounds and support, are not associated with an increased likelihood of engaging in PA at this time. Efforts should be made to improve neighborhood accessibility and design in order to increase PA among children with ASD.",pubmed,0.5060469786064771
912,1893,Development of the Macquarie Anxiety Behavioural Scale (MABS): A parent measure to assess anxiety in children and adolescents including young people with autism spectrum disorder.,2020-07-15 00:00:00,,Journal of affective disorders,S0165-0327(20)32473-3,,"This study examined measurement variance for Autism Spectrum Disorder (ASD) in the Spence Children's Anxiety Scale - Parent Form (SCAS-P; Spence, 1999). In addition, we developed and evaluated a new parent report measure for anxiety (Macquarie Anxiety Behavioural Scale; MABS).",pubmed,0.5059475199782992
860,1831,Resting and Functional Pupil Response Metrics Indicate Features of Reward Sensitivity and ASD in Children.,2020-09-25 00:00:00,,Journal of autism and developmental disorders,10.1007/s10803-020-04721-y,,"The current study examined the relationship between quantitative measures of reward and punishment sensitivity, features of autism spectrum disorder (ASD), and resting and functional pupil response metrics across a clinically heterogeneous sample. Scores on a parent-report measure of punishment and reward sensitivity were correlated with ASD features. We also assessed whether pupil measurements could be used as a physiologic correlate of reward sensitivity and predictor of ASD diagnosis. In a logistic regression model, pupil dilation metrics, sex, and IQ, correctly classified 86.3% of participants as having an ASD diagnosis versus not. This research highlights individual differences of reward sensitivity associated with ASD features. Results support the use of pupil metrics and other patient-level variables as predictors of ASD diagnostic status.",pubmed,0.5052276096726849
615,1551,Autism Detection in Children by Combined Use of Gaze Preference and the M-CHAT-R in a Resource-Scarce Setting.,2021-02-16 00:00:00,,Journal of autism and developmental disorders,10.1007/s10803-021-04878-0,,"Most children with autism spectrum disorder (ASD), in resource-limited settings (RLS), are diagnosed after the age of four. Our work confirmed and extended results of Pierce that eye tracking could discriminate between typically developing (TD) children and those with ASD. We demonstrated the initial 15 s was at least as discriminating as the entire video. We evaluated the GP-MCHAT-R, which combines the first 15 s of manually-coded gaze preference (GP) video with M-CHAT-R results on 73 TD children and 28 children with ASD, 36-99 months of age. The GP-MCHAT-R (AUC = 0.89 (95%CI: 0.82-0.95)), performed significantly better than the MCHAT-R (AUC = 0.78 (95%CI: 0.71-0.85)) and gaze preference (AUC = 0.76 (95%CI: 0.64-0.88)) alone. This tool may enable early screening for ASD in RLS.",pubmed,0.5048357548190536
811,1778,Predicting brain age with complex networks: From adolescence to adulthood.,2020-10-21 00:00:00,,NeuroImage,S1053-8119(20)30943-5,,"In recent years, several studies have demonstrated that machine learning and deep learning systems can be very useful to accurately predict brain age. In this work, we propose a novel approach based on complex networks using 1016 T1-weighted MRI brain scans (in the age range 7-64years). We introduce a structural connectivity model of the human brain: MRI scans are divided in rectangular boxes and Pearson's correlation is measured among them in order to obtain a complex network model. Brain connectivity is then characterized through few and easy-to-interpret centrality measures; finally, brain age is predicted by feeding a compact deep neural network. The proposed approach is accurate, robust and computationally efficient, despite the large and heterogeneous dataset used. Age prediction accuracy, in terms of correlation between predicted and actual age r=0.89and Mean Absolute Error MAE =2.19years, compares favorably with results from state-of-the-art approaches. On an independent test set including 262 subjects, whose scans were acquired with different scanners and protocols we found MAE =2.52. The only imaging analysis steps required in the proposed framework are brain extraction and linear registration, hence robust results are obtained with a low computational cost. In addition, the network model provides a novel insight on aging patterns within the brain and specific information about anatomical districts displaying relevant changes with aging.",pubmed,0.504422227209853
426,1331,Cognitive-behavioral family therapy as psychoeducation for adolescents with high-functioning autism spectrum disorders: Aware and Care for my Autistic Traits (ACAT) program study protocol for a pragmatic multisite randomized controlled trial.,2020-09-29 00:00:00,,Trials,10.1186/s13063-020-04750-z,,"One aim of an autism spectrum disorder (ASD) diagnosis is to obtain special support for the disorder, though this does not guarantee practical support. We developed a psychoeducational program using cognitive-behavioral therapy (CBT) and Aware and Care for my Autistic Traits (ACAT) for Japanese adolescents with high-functioning ASD and their parents.",pubmed,0.5024270421536033
899,1877,Adaptation and validation of the Genetic Counseling Outcome Scale for autism spectrum disorders and related conditions.,2020-09-06 00:00:00,,Journal of genetic counseling,10.1002/jgc4.1323,,"The genetics care pathway experienced by families affected by autism spectrum disorder (ASD) around the time of diagnosis is currently uncharacterized and potentially variable across contexts. The lack of consensus on outcome measures to capture the impact of genetic services for these families shows a gap in understanding and optimizing this genetics care pathway. The Genetic Counseling Outcome Scale (GCOS-24) is a validated outcome measure of clinical genetics services. The current study aims to adapt and validate the GCOS-24 as an outcome measure in the context routine genetic testing in ASD and related conditions. Families seen for their child's developmental evaluation for ASD and related conditions were invited to participate in a genomics cohort between 2016 and 2018. Families (n = 111) completed the mGCOS-24 (modified GCOS-24), adapted from the original GCOS-24 by clinicians working in the target population's routine care pathway. The mGCOS-24 has acceptable internal consistency (Cronbach's α = 0.84) and high test-retest reliability (ICC = 0.88). It also inversely correlates with stress as measured by Perceived Stress Scale (PSS-10) and distress, as measured by the Distress Thermometer, rs ≥ 0.39, ps < 0.001. The mGCOS-24 had adequate readability, as supported by cognitive interviews completed by a sub-sample of five mothers of a child with ASD. Together, our findings show that the mGCOS-24 has good validity for the target population. Preliminary characterization of the genetics care pathway in this population revealed remarkable variability in pre-test counseling and limited post-test counseling. The use of the mGCOS-24 as an outcome measure is useful in filling some of these gaps by offering a way to assess, and in the future, optimize the genetics care pathway for families affected by autism and related neurodevelopmental conditions.",pubmed,0.502379742742785
76,604,Associations between domains of health-related quality of life and co-occurring emotional and behavioral problems in youth with autism spectrum disorder,,Developmental and Educational Psychology,,10.1016/j.rasd.2021.101740,"{'given': 'Michelle', 'family': 'Menezes', 'sequence': 'first', 'affiliation': []}",,crossref,0.5023612515648075
187,1058,Brief Report: Health-Related Quality of Life in Preschoolers with Autism Spectrum Disorder is Related to Diagnostic Age and Autistic Symptom Severity.,2021-02-10 00:00:00,,Journal of autism and developmental disorders,10.1007/s10803-021-04909-w,,"We conducted a cross-sectional study to explore whether clinical characteristics and autism diagnostic-traits severity are associated with caregiver-reported impairment of health-related quality of life (Pediatric Quality of Life Inventory Generic Core Scales, Fourth Edition) in 93 Chilean toddlers (age: 2-4 years) with autism spectrum disorder. Median total scale, physical health, and psychosocial health scores were 76 (IQR 70-81), 88 (IQR 81-94), and 71 (IQR 62-79), respectively. In multiple-regression analysis, diagnostic age (β = 0.219; p 0.021) and Calibrated Severity Score of Autism Diagnostic Observation Schedule, second edition (β = - 0.434; p < 0.001) were independently correlated to the total scale score. Lower age and higher autistic traits severity at diagnosis are correlated with worse well-being perception by caregivers.",pubmed,0.5021487922552662
727,1679,Novel alterations of <i>CC2D1A</i> as a candidate gene in a Turkish sample of patients with autism spectrum disorder.,2020-12-28 00:00:00,,The International journal of neuroscience,10.1080/00207454.2020.1860968,,"Autism spectrum disorder (ASD) is a neurodevelopmental disorder with large genetic background, but identification of pathogenic variants has proceeded slowly because hundreds of loci are involved in this complex disorder. <i>CC2D1A</i> gene firstly associated with the intellectual disability (ID) in a family with a large deletion. We aimed to contribute to the literature by sequencing this gene and by this way we report novel <i>CC2D1A</i> variations in patients with ASD.",pubmed,0.5009837893972806
913,1895,Maternal Influenza A(H1N1) Immunization During Pregnancy and Risk for Autism Spectrum Disorder in Offspring : A Cohort Study.,2020-09-01 00:00:00,,Annals of internal medicine,10.7326/M20-0167,,There are concerns that influenza vaccine exposure during pregnancy may be associated with increased risk for autism spectrum disorder (ASD).,pubmed,0.500966616510004
288,1175,Down Syndrome and Autism Spectrum Disorder Dual Diagnosis: Important Considerations for Speech-Language Pathologists.,2020-12-14 00:00:00,,American journal of speech-language pathology,10.1044/2020_AJSLP-20-00050,,"Purpose Individuals with Down syndrome (DS) often receive speech-language therapy services starting in infancy or toddlerhood. When providing speech-language therapy services for children with DS, speech-language pathologists (SLPs) need to consider the impact of other developmental and comorbid disorders that can affect language development, such as the presence of a dual diagnosis of DS and autism spectrum disorder (DS + ASD). The prevalence rate of ASD in DS is ~20%, which is higher than in the general population. Method This clinical focus article aims to provide SLPs with additional knowledge about DS + ASD to improve service delivery and support parents' ability to advocate for their child with confirmed or suspected DS + ASD. This is accomplished by summarizing the current evidence base on the presence of ASD in DS and discussing implications of a DS + ASD diagnosis for clinical practice with SLPs. Conclusions SLPs play a key role in supporting families of those with DS + ASD by advocating and educating. By understanding the unique profiles of strengths and weaknesses of individuals with DS + ASD, SLPs can provide appropriate service delivery (i.e., treatment and intervention approaches) and advocacy for their clients and their families.",pubmed,0.4994879639591964
391,1295,Health system utilization before age 1 among children later diagnosed with autism or ADHD.,2020-10-19 00:00:00,,Scientific reports,10.1038/s41598-020-74458-2,,"Children with autism spectrum disorder (ASD) or attention deficit hyperactivity disorder (ADHD) have 2-3 times increased healthcare utilization and annual costs once diagnosed, but little is known about their utilization patterns early in life. Quantifying their early health system utilization could uncover condition-specific health trajectories to facilitate earlier detection and intervention. Patients born 10/1/2006-10/1/2016 with ≥ 2 well-child visits within the Duke University Health System before age 1 were grouped as ASD, ADHD, ASD + ADHD, or No Diagnosis using retrospective billing codes. An additional comparison group was defined by later upper respiratory infection diagnosis. Adjusted odds ratios (AOR) for hospital admissions, procedures, emergency department (ED) visits, and outpatient clinic encounters before age 1 were compared between groups via logistic regression models. Length of hospital encounters were compared between groups via Mann-Whitney U test. In total, 29,929 patients met study criteria (ASD N = 343; ADHD N = 1175; ASD + ADHD N = 140). ASD was associated with increased procedures (AOR = 1.5, p < 0.001), including intubation and ventilation (AOR = 2.4, p < 0.001); and outpatient specialty care, including physical therapy (AOR = 3.5, p < 0.001) and ophthalmology (AOR = 3.1, p < 0.001). ADHD was associated with increased procedures (AOR = 1.41, p < 0.001), including blood transfusion (AOR = 4.7, p < 0.001); hospital admission (AOR = 1.60, p < 0.001); and ED visits (AOR = 1.58, p < 0.001). Median length of stay was increased after birth in ASD (+ 6.5 h, p < 0.001) and ADHD (+ 3.8 h, p < 0.001), and after non-birth admission in ADHD (+ 1.1 d, p < 0.001) and ASD + ADHD (+ 2.4 d, p = 0.003). Each condition was associated with increased health system utilization and distinctive patterns of utilization before age 1. Recognizing these patterns may contribute to earlier detection and intervention.",pubmed,0.49839111650305307
576,1508,Trajectories of Symptom Severity in Children with Autism: Variability and Turning Points through the Transition to School.,2021-03-11 00:00:00,,Journal of autism and developmental disorders,10.1007/s10803-021-04949-2,,"This study examined the trajectories of autistic symptom severity in an inception cohort of 187 children with ASD assessed across four time points from diagnosis to age 10. Trajectory groups were derived using multivariate cluster analysis. A two trajectory/cluster solution was selected. Change in trajectory slopes revealed a turning point marked by plateauing in symptom reduction during the period of transition to school (age 6) for one of the two trajectories. Trajectories were labelled: Continuously Improving (27%) and Improving then Plateauing (73% of sample). Children in the two trajectories differed in levels of symptom severity, language, cognitive, and adaptive functioning skills. Study findings can inform the development of more personalized services for children with ASD transitioning into the school system.",pubmed,0.49825339596896095
710,1657,Developmental effects in physiological stress in early adolescents with and without autism spectrum disorder.,2020-12-16 00:00:00,,Psychoneuroendocrinology,S0306-4530(20)30538-2,,"Humans place high value on how they are socially evaluated by others. The Trier Social Stress Test (TSST) is a well-established measure of social evaluative threat that promotes activation of the hypothalamic pituitary adrenal (HPA) axis and release of cortisol. Higher cortisol responses in typically developing (TD) adolescents are influenced by age and pubertal development especially in later stages. Children with ASD have been shown to exhibit blunted cortisol in response to the TSST although adults with ASD show a more prototypical response. The current study examined physiological stress in early adolescents with ASD and TD. It was hypothesized that TD youth would show elevated cortisol in response to the TSST influenced by age and pubertal stage. In contrast, youth with ASD would show a more diminished stress response yet still show effects for age and pubertal development METHODS: The sample included 241 youth, 138 with ASD (median age=11.25) and 103 TD (median age=11.67). Standardized diagnostic and pubertal development (genital/breast (GB), and pubic hair (PH) stage) physical exams were performed. Salivary cortisol was collected before and after the TSST. Linear mixed effects models examined the effects of baseline cortisol, time, age, sex, pubertal stage, and diagnosis.",pubmed,0.4979298872023879
927,1909,Comprehending reflexive and clitic constructions in children with autism spectrum disorder and developmental language disorder.,2020-08-26 00:00:00,,International journal of language & communication disorders,10.1111/1460-6984.12568,,"It has been established that people with autism spectrum disorder (ASD) often have difficulties understanding spoken language. Understanding reflexive and clitic pronouns is vital to establishing reference-based inference, but it is as yet unclear whether such constructions pose specific difficulties for those with ASD. Pronoun interpretation seems be connected to the development of pragmatic abilities, and can therefore be considered a plausible marker in the differential diagnosis between ASD and developmental language disorder (DLD).",pubmed,0.4958338108879176
375,1276,Prevalence of and Factors Associated with School Bullying in Students with Autism Spectrum Disorder: A Cross-Cultural Meta-Analysis.,,,Yonsei medical journal,10.3349/ymj.2020.61.11.909,,"Through this meta-analysis, we sought to examine the prevalence of, risks for, and factors associated with bullying involvement (victimization, perpetration, perpetration-victimization) among students with autism spectrum disorder (ASD). Additionally, we attempted to examine sources of variance in the prevalence and effect sizes of bullying in students with ASD across studies. Systematic database and literature review identified 34 relevant studies (31 for Western countries, three for Eastern countries). Pooled prevalence estimates for victimization, perpetration, and perpetration-victimization in general were 67%, 29%, and 14%, respectively. The risk of victimization in students with ASD was significantly higher than that in typically developing students and students with other disabilities. Further, deficits in social interaction and communication, externalizing symptoms, internalizing symptoms, and integrated inclusive school settings were related to higher victimization, and externalizing symptoms were related to higher perpetration. Finally, moderation analyses revealed significant variations in the pooled prevalences thereof depending on culture, age, school settings, and methodological quality and in the pooled effect sizes according to publication year and methodological quality. Our results highlight needs for bullying intervention for students with ASD, especially those who are younger, are in an inclusive school setting, and have higher social difficulties and externalizing/internalizing symptoms; for intensive research of bullying experiences among students with ASD in Eastern countries; and for efforts to improve the methodological quality of such research.",pubmed,0.49535864963908344
