,Unnamed: 0,title,publication date,subject,journal,DOI,author,abstract,from_database,tfidf_score
162,1030,Dysbiotic Gut Microbiota and Dysregulation of Cytokine Profile in Children and Teens With Autism Spectrum Disorder.,2021-02-10 00:00:00,,Frontiers in neuroscience,10.3389/fnins.2021.635925,,"Inflammation and the gut-brain axis have been implicated in the pathogenesis of autism spectrum disorders (ASDs). To further understand the relationship between aberrant immune responses and dysbiotic features of the gut microbiome in ASD, we enrolled 45 ASD individuals and 41 healthy control subjects with ages ranging from 2 to 19 years. We found that ASD group subjects have significantly higher plasma levels of IL-2, IL-4, IL-5, IL-6, IL-10, TNF-α, TNF-β, and IFN-γ when compared to healthy controls (FDR-adjusted <i>p</i> < 0.05). The plasma levels of pro-inflammatory cytokines IFN-γ and IL-6 are found to be further associated with several largely pathogenic gut microbiota uniquely detected in subjects with ASD. Furthermore, the ASD gut microbiome is characterized by reduced levels of several beneficial microbiota, including <i>Bacteroides</i> (FDR-adjusted <i>p</i> < 0.01) and Lachnospiraceae (FDR-adjusted <i>p</i> < 0.001). Analysis of Lachnospiraceae family and genus level taxa suggested that relative abundances of such taxa are negatively correlated with pro-inflammatory signaling cytokines IFN-γ and IL-6, particularly in subjects with severe ASD as defined by CARS (<i>p</i> < 0.05). Several largely pathogenic genera are determined to be associated with the pro-inflammatory cytokines IFN-γ and IL-6 (FDR-adjusted <i>p</i> < 0.1). Additionally, IL-4 is significantly negatively correlated with CARS total score (<i>p</i> < 0.05). Based on such results, we propose that the association between the disturbances of specific cytokines and alterations in gut microbiota abundance observed in children and adolescents with ASD provides additional evidence on the induction of aberrant pro-inflammatory mechanisms in ASD and its early diagnosis.",pubmed,0.3907948679036904
23,212,Sleep disturbances and physical health problems in caregivers of children with ASD,,Developmental and Educational Psychology,,10.1016/j.ridd.2021.103932,"{'given': 'Brian', 'family': 'Lovell', 'sequence': 'first', 'affiliation': []}",,crossref,0.38977515700719584
853,1823,A Genotype-Phenotype Study of High-Resolution <i>FMR1</i> Nucleic Acid and Protein Analyses in Fragile X Patients with Neurobehavioral Assessments.,2020-09-30 00:00:00,,Brain sciences,E694,,"Fragile X syndrome (FXS) is caused by silencing of the <i>FMR1</i> gene, which encodes a protein with a critical role in synaptic plasticity. The molecular abnormality underlying <i>FMR1</i> silencing, CGG repeat expansion, is well characterized; however, delineation of the pathway from DNA to RNA to protein using biosamples from well characterized patients with FXS is limited. Since FXS is a common and prototypical genetic disorder associated with intellectual disability (ID) and autism spectrum disorder (ASD), a comprehensive assessment of the <i>FMR1</i> DNA-RNA-protein pathway and its correlations with the neurobehavioral phenotype is a priority. We applied nine sensitive and quantitative assays evaluating <i>FMR1</i> DNA, RNA, and FMRP parameters to a reference set of cell lines representing the range of <i>FMR1</i> expansions. We then used the most informative of these assays on blood and buccal specimens from cohorts of patients with different <i>FMR1</i> expansions, with emphasis on those with FXS (N = 42 total, N = 31 with FMRP measurements). The group with FMRP data was also evaluated comprehensively in terms of its neurobehavioral profile, which allowed molecular-neurobehavioral correlations. <i>FMR1</i> CGG repeat expansions, methylation levels, and FMRP levels, in both cell lines and blood samples, were consistent with findings of previous <i>FMR1</i> genomic and protein studies. They also demonstrated a high level of agreement between blood and buccal specimens. These assays further corroborated previous reports of the relatively high prevalence of methylation mosaicism (slightly over 50% of the samples). Molecular-neurobehavioral correlations confirmed the inverse relationship between overall severity of the FXS phenotype and decrease in FMRP levels (N = 26 males, mean 4.2 ± 3.3 pg FMRP/ng genomic DNA). Other intriguing findings included a significant relationship between the diagnosis of FXS with ASD and two-fold lower levels of FMRP (mean 2.8 ± 1.3 pg FMRP/ng genomic DNA, <i>p</i> = 0.04), in particular observed in younger age- and IQ-adjusted males (mean age 6.9 ± 0.9 years with mean 3.2 ± 1.2 pg FMRP/ng genomic DNA, 57% with severe ASD), compared to FXS without ASD. Those with severe ID had even lower FMRP levels independent of ASD status in the male-only subset. The results underscore the link between <i>FMR1</i> expansion, gene methylation, and FMRP deficit. The association between FMRP deficiency and overall severity of the neurobehavioral phenotype invites follow up studies in larger patient cohorts. They would be valuable to confirm and potentially extend our initial findings of the relationship between ASD and other neurobehavioral features and the magnitude of FMRP deficit. Molecular profiling of individuals with FXS may have important implications in research and clinical practice.",pubmed,0.3896340039497987
72,589,Sleep and stereotypy in children with autism: effectiveness of function-based behavioral treatment,,General Medicine,,10.1016/j.sleep.2021.01.062,"{'given': 'Jolene E.', 'family': 'Hunter', 'sequence': 'first', 'affiliation': []}",,crossref,0.38961028200431114
86,702,"Dance, rhythm, and autism spectrum disorder: An explorative study",,Clinical Psychology,,10.1016/j.aip.2020.101755,"{'ORCID': 'http://orcid.org/0000-0003-4543-4163', 'authenticated-orcid': False, 'given': 'Phoebe O.', 'family': 'Morris', 'sequence': 'first', 'affiliation': []}",,crossref,0.38881406615460545
496,1414,"Treatment use among children with Tourette syndrome living in the United States, 2014.",2020-08-18 00:00:00,,Psychiatry research,S0165-1781(20)32172-7,,"Treatment of Tourette syndrome (TS) can be complicated by changes over time in tic expression, severity, and co-occurring disorders. Using the 2014 National Survey of the Diagnosis and Treatment of ADHD and Tourette Syndrome, this study provides descriptive estimates of the use of behavioral interventions and medication among children living with TS. Parent-reported data on 115 children aged 5-17 years ever diagnosed with TS were analyzed to provide descriptive, unweighted results. Overall, 77.4% of children had current or past use of any TS treatment; 59.1% ever used behavioral interventions and 56.1% had ever taken TS medication. Children with ""moderate"" or ""severe"" versus ""mild"" TS, ≥1 co-occurring disorders, and tics that interfered with functioning were significantly more likely to have used one or more TS treatments. Side effects were reported for 84.4% of children who took TS medication. Most parents of children with current TS (87.2%) were satisfied with the management of their child's TS. However, parents of children with ""moderate"" or ""severe"" current TS were significantly more dissatisfied compared to parents of children with ""mild"" TS. Findings from this study could be used to inform efforts to support children living with TS and their families.",pubmed,0.38831070372849386
102,816,Visual attention prediction for Autism Spectrum Disorder with hierarchical semantic fusion,,Signal Processing,,10.1016/j.image.2021.116186,"{'given': 'Yuming', 'family': 'Fang', 'sequence': 'first', 'affiliation': []}",,crossref,0.387807222525752
51,420,Examining the correlation between symptoms of obsessive compulsive disorder and autism spectrum disorder in a community-based sample of adults,,Biological Psychiatry,,10.1016/j.psychres.2021.113826,"{'given': 'Lucy', 'family': 'Barnard-Brak', 'sequence': 'first', 'affiliation': []}",,crossref,0.38770881731371365
934,1918,"Is cognitive inflexibility a missing link? The role of cognitive inflexibility, alexithymia and intolerance of uncertainty in externalising and internalising behaviours in young people with autism spectrum disorder.",2020-08-21 00:00:00,,"Journal of child psychology and psychiatry, and allied disciplines",10.1111/jcpp.13295,,"Internalising (anxiety and low mood) and externalising (aggressive or outburst behaviours, and irritability) difficulties are very common in autism spectrum disorder (ASD) across the life span, relatively stable over time and often associated with poorer quality of life. Understanding the cognitive mechanisms underlying internalising and externalising difficulties in ASD is essential for developing targeted supports and interventions. In the present study, we investigated established and less-researched cognitive factors hypothesised to contribute to internalising and/or externalising difficulties in ASD, namely cognitive inflexibility (CI), intolerance of uncertainty (IU) and alexithymia. Based on previous models and clinical experience, we hypothesised that IU would lead to internalising symptoms, with alexithymia contributing to this pathway, and that CI would have a direct effect on externalising behaviours and may indirectly contribute to internalising symptoms via increasing IU.",pubmed,0.38748707467777516
231,1109,Diagnostic genetic testing for neurodevelopmental psychiatric disorders: closing the gap between recommendation and clinical implementation.,2021-01-09 00:00:00,,Current opinion in genetics & development,S0959-437X(20)30180-5,,"Advances in laboratory testing have significantly increased the detection of rare genetic etiologies of neurodevelopmental psychiatric disorders (NPD), particularly developmental delay/ intellectual disability, autism spectrum disorder, and schizophrenia. Establishing a genetic diagnosis has important medical and personal utility for individuals with these conditions. Diagnostic genetic tests for NPD are clinically available but underutilized outside of medical genetics settings. Without clear multidisciplinary consensus recommendations, active involvement of medical specialists working with NPD patients, and practical education and training, the implementation of genetic testing for NPD will continue to lag behind other areas of medicine. In the long-term, collaborative efforts to address educational, logistical, and workforce obstacles will improve patient care and pave the way for targeted, effective NPD treatments.",pubmed,0.3869216839140415
844,1814,"Corrigendum: Parental Attunement, Insightfulness, and Acceptance of Child Diagnosis in Parents of Children With Autism: Clinical Implications.",2020-09-15 00:00:00,,Frontiers in psychology,10.3389/fpsyg.2020.593327,,[This corrects the article DOI: 10.3389/fpsyg.2020.01849.].,pubmed,0.3859772169669555
524,1446,"Elevated rates of autism, other neurodevelopmental and psychiatric diagnoses, and autistic traits in transgender and gender-diverse individuals.",2020-08-07 00:00:00,,Nature communications,10.1038/s41467-020-17794-1,,"It is unclear whether transgender and gender-diverse individuals have elevated rates of autism diagnosis or traits related to autism compared to cisgender individuals in large non-clinic-based cohorts. To investigate this, we use five independently recruited cross-sectional datasets consisting of 641,860 individuals who completed information on gender, neurodevelopmental and psychiatric diagnoses including autism, and measures of traits related to autism (self-report measures of autistic traits, empathy, systemizing, and sensory sensitivity). Compared to cisgender individuals, transgender and gender-diverse individuals have, on average, higher rates of autism, other neurodevelopmental and psychiatric diagnoses. For both autistic and non-autistic individuals, transgender and gender-diverse individuals score, on average, higher on self-report measures of autistic traits, systemizing, and sensory sensitivity, and, on average, lower on self-report measures of empathy. The results may have clinical implications for improving access to mental health care and tailoring adequate support for transgender and gender-diverse individuals.",pubmed,0.3858748034016409
266,1147,Actionable and incidental neuroradiological findings in twins with neurodevelopmental disorders.,2020-12-29 00:00:00,,Scientific reports,10.1038/s41598-020-79959-8,,"While previous research has investigated neuroradiological findings in autism spectrum disorder (ASD) and attention-deficit hyperactivity disorder (ADHD), the entire range of neurodevelopmental disorders (NDDs) has not yet been well-studied using magnetic resonance imaging (MRI). Considering the overlap among NDDs and simultaneous development of the brain and face, guided by molecular signaling, we examined the relationship of actionable and incidental (non-actionable) MRI findings and NDD diagnoses together with facial morphological variants and genetic copy number variants (CNVs). A cross-sectional study was conducted with a twin cohort 8-36 years of age (57% monozygotic, 40% dizygotic), including 372 subjects (46% with NDDs; 47% female) imaged by MRI, 280 with data for facial morphological variants, and 183 for CNVs. Fifty-one percent of participants had MRI findings. Males had a statistically significantly higher percentage of MRI findings (57.7%) compared with females (43.8%, p = 0.03). Twin zygosity was not statistically significantly correlated with incidence or severity of specific MRI findings. No statistically significant association was found between MRI findings and any NDD diagnosis or facial morphological variants; however, MRI findings were statistically significantly associated with the number of CNVs (OR 1.20, 95% CI 1.00-1.44, p = 0.05, adjusted OR for sex 1.24, 95% CI 1.03-1.50, p = 0.02). When combining the presence of MRI findings, facial morphological variants, and CNVs, statistically significant relationships were found with ASD and ADHD diagnoses (p = 0.0006 and p = 0.002, respectively). The results of this study demonstrate that the ability to identify NDDs from combined radiology, morphology, and CNV assessments may be possible. Additionally, twins do not appear to be at increased risk for neuroradiological variants.",pubmed,0.3855795967280859
343,1235,Risk Stratification for Bipolar Disorder Using Polygenic Risk Scores Among Young High-Risk Adults.,2020-10-26 00:00:00,,Frontiers in psychiatry,10.3389/fpsyt.2020.552532,,"<b>Objective:</b> Identifying high-risk groups with an increased genetic liability for bipolar disorder (BD) will provide insights into the etiology of BD and contribute to early detection of BD. We used the BD polygenic risk score (PRS) derived from BD genome-wide association studies (GWAS) to explore how such genetic risk manifests in young, high-risk adults. We postulated that BD-PRS would be associated with risk factors for BD. <b>Methods:</b> A final sample of 185 young, high-risk German adults (aged 18-35 years) were grouped into three risk groups and compared to a healthy control group (<i>n</i> = 1,100). The risk groups comprised 117 cases with attention deficit hyperactivity disorder (ADHD), 45 with major depressive disorder (MDD), and 23 help-seeking adults with early recognition symptoms [ER: positive family history for BD, (sub)threshold affective symptomatology and/or mood swings, sleeping disorder]. BD-PRS was computed for each participant. Logistic regression models (controlling for sex, age, and the first five ancestry principal components) were used to assess associations of BD-PRS and the high-risk phenotypes. <b>Results:</b> We observed an association between BD-PRS and combined risk group status (OR = 1.48, <i>p</i> < 0.001), ADHD diagnosis (OR = 1.32, <i>p</i> = 0.009), MDD diagnosis (OR = 1.96, <i>p</i> < 0.001), and ER group status (OR = 1.7, <i>p</i> = 0.025; not significant after correction for multiple testing) compared to healthy controls. <b>Conclusions:</b> In the present study, increased genetic risk for BD was a significant predictor for MDD and ADHD status, but not for ER. These findings support an underlying shared risk for both MDD and BD as well as ADHD and BD. Improving our understanding of the underlying genetic architecture of these phenotypes may aid in early identification and risk stratification.",pubmed,0.38526502356795506
790,1752,NCKAP1 Disruptive Variants Lead to a Neurodevelopmental Disorder with Core Features of Autism.,,,American journal of human genetics,S0002-9297(20)30360-8,,"NCKAP1/NAP1 regulates neuronal cytoskeletal dynamics and is essential for neuronal differentiation in the developing brain. Deleterious variants in NCKAP1 have been identified in individuals with autism spectrum disorder (ASD) and intellectual disability; however, its clinical significance remains unclear. To determine its significance, we assemble genotype and phenotype data for 21 affected individuals from 20 unrelated families with predicted deleterious variants in NCKAP1. This includes 16 individuals with de novo (n = 8), transmitted (n = 6), or inheritance unknown (n = 2) truncating variants, two individuals with structural variants, and three with potentially disruptive de novo missense variants. We report a de novo and ultra-rare deleterious variant burden of NCKAP1 in individuals with neurodevelopmental disorders which needs further replication. ASD or autistic features, language and motor delay, and variable expression of intellectual or learning disability are common clinical features. Among inherited cases, there is evidence of deleterious variants segregating with neuropsychiatric disorders. Based on available human brain transcriptomic data, we show that NCKAP1 is broadly and highly expressed in both prenatal and postnatal periods and demostrate enriched expression in excitatory neurons and radial glias but depleted expression in inhibitory neurons. Mouse in utero electroporation experiments reveal that Nckap1 loss of function promotes neuronal migration during early cortical development. Combined, these data support a role for disruptive NCKAP1 variants in neurodevelopmental delay/autism, possibly by interfering with neuronal migration early in cortical development.",pubmed,0.3850669161576588
106,864,"The Influence of Infant Father""s and Mother""s Participation in Play and Parenting on Children""s Problem Behavior",,,,10.37918/kce.2021.3.127.117,"{'given': 'Kyoung-Hee', 'family': 'Kim', 'sequence': 'first', 'affiliation': []}",,crossref,0.38472469716384045
10,52,Nutritional assessment of children suffering from Autism,,,,10.19045/bspab.2021.100123,"{'given': 'Aniqa', 'family': 'Amjad', 'sequence': 'first', 'affiliation': []}",,crossref,0.3843475749048071
857,1827,Development of a Web-Based Resource for Parents of Young Children Newly Diagnosed With Autism: Participatory Research Design.,2020-09-30 00:00:00,,JMIR pediatrics and parenting,10.2196/15786,,"The internet provides an ideal avenue to share information, advice, and support regarding autism. However, many websites lack quality control and rarely provide a one-stop resource for families to access necessary, evidence-based information.",pubmed,0.3837475201548379
131,994,Barriers to access and utilization of healthcare by children with neurological impairments and disability in low-and middle-income countries: a systematic review,,,,10.12688/wellcomeopenres.16593.1,"{'given': 'Lucy W.', 'family': 'Mwangi', 'sequence': 'first', 'affiliation': []}","<ns3:p><ns3:bold>Background: </ns3:bold>Neurological impairments (NI) and disability are common among survivors of childhood mortality in low-and middle-income countries (LMICs). We conducted a systematic review to examine the barriers limiting access and utilization of biomedical care by children and adolescents with NI in LMICs.</ns3:p><ns3:p> <ns3:bold>Methods: </ns3:bold>We searched PubMed, Latin America and Caribbean Health Sciences Literature, Global Index Medicus, and Google Scholar for studies published between 01/01/1990 and 14/11/2019 to identify relevant studies. We included all reports on barriers limiting access and utilization of preventive, curative, and rehabilitative care for children aged 0-19 years with NI in five domains: epilepsy, and cognitive, auditory, visual, and motor function impairment. Data from primary studies were synthesized using both qualitative and quantitative approaches, and we report a synthesized analysis of the barriers identified in the primary studies.</ns3:p><ns3:p> <ns3:bold>Results: </ns3:bold>Our literature searches identified 3,074 reports of which 16 were included in the final analysis. Fourteen studies (87.5%) originated from rural settings in sub-Saharan Africa (SSA). Factors limiting access and utilization of healthcare services in &gt;50% of the studies were: financial constraints (N=15, 93.8%), geographical inaccessibility (N=11, 68.8%), inadequate healthcare resources (N=11, 68.8%), inadequate education/awareness (N=9, 56.3%), and prohibitive culture/beliefs (N=9, 56.3%). Factors reported in &lt;50% of the studies related to the attitude of the patient, health worker, or society (N=7, 43.8%), poor doctor-patient communication (N=5, 31.3%), physical inaccessibility (N=3, 18.8%), and a lack of confidentiality for personal information (N=2, 12.5%). Very few reports were identified from outside Africa preventing a statistical analysis by continent and economic level.</ns3:p><ns3:p> <ns3:bold>Conclusions: </ns3:bold>Financial constraints, geographic inaccessibility, and inadequate healthcare resources were the most common barriers limiting access and utilization of healthcare services by children with NI in LMICs.</ns3:p><ns3:p> <ns3:bold>PROSPERO registration:</ns3:bold> CRD42020165296 (28/04/2020)</ns3:p>",crossref,0.3835822477561341
366,1265,"An Examination of Parent-Reported Facilitators and Barriers to Organized Physical Activity Engagement for Youth With Neurodevelopmental Disorders, Physical, and Medical Conditions.",2020-09-29 00:00:00,,Frontiers in psychology,10.3389/fpsyg.2020.568723,,"Organized physical activity (OPA) is an important contributor to physical, social, and emotional health and well-being; however, young people with disabilities are participating at lower rates than their peers without disabilities. This study aimed to (1) compare facilitators and barriers to OPA for young people with disabilities who currently do and do not participate in OPA and (2) to assess whether groups differed in the type of internal and external assets they reported. Parents of 218 young people (41% with a primary diagnosis of autism spectrum disorder) with a diverse representation of disabilities completed an online survey. Young people were categorized as either participants in OPA (<i>n</i> = 131) or non-participants (<i>n</i> = 87) by parent report. Non-participation was significantly predicted by the barrier ""there are no activities my child enjoys"" and by a lack of children's motivation and happiness during OPA. Significant internal assets differentiating participants from non-participants were the ability to understand simple instructions, love of sport, and meeting physical activity guidelines. Significant external assets were parent and sibling participation in OPA, school type, and household income. The findings from this study have important implications for the design of public health interventions that aim to promote OPA in young people with disabilities, highlighting the need to make activities enjoyable, promote participation of siblings and parents, and support low-income families to participate.",pubmed,0.3834682818235189
