,Unnamed: 0,title,publication date,subject,journal,DOI,author,abstract,from_database,tfidf_score
746,1700,Simultaneous evaluation of antioxidative serum profiles facilitates the diagnostic screening of autism spectrum disorder in under-6-year-old children.,2020-11-26 00:00:00,,Scientific reports,10.1038/s41598-020-77328-z,,"This case-control study aimed to assess oxidative stress alterations in autism spectrum disorder (ASD). We used the MULTIS method, an electron spin resonance-based technique measuring multiple free radical scavenging activities simultaneously, in combination with conventional oxidative stress markers to investigate the ability of this MULTIS approach as a non-behavioural diagnostic tool for children with ASD. Serum samples of 39 children with ASD and 58 age-matched children with typical development were analysed. The ASD group showed decreased hydroxyl radical (<sup>·</sup>OH) and singlet oxygen scavenging activity with increased serum coenzyme Q10 oxidation rate, indicating a prooxidative tendency in ASD. By contrast, scavenging activities against superoxide (O<sub>2</sub><sup>·-</sup>) and alkoxyl radical (RO<sup>·</sup>) were increased in the ASD group suggesting antioxidative shifts. In the subgroup analysis of 6-year-olds or younger, the combination of <sup>·</sup>OH, O<sub>2</sub><sup>·-</sup>, and RO<sup>·</sup> scavenging activities predicted ASD with high odds ratio (50.4), positive likelihood (12.6), and percentage of correct classification (87.0%). Our results indicate that oxidative stress in children with ASD is not simply elevated but rather shows a compensatory shift. MULTIS measurements may serve as a very powerful non-behavioural tool for the diagnosis of ASD in children.",pubmed,0.6222324239977796
669,1612,A voxel-wise assessment of growth differences in infants developing autism spectrum disorder.,2020-12-29 00:00:00,,NeuroImage. Clinical,S2213-1582(20)30388-0,,"Autism Spectrum Disorder (ASD) is a phenotypically and etiologically heterogeneous developmental disorder typically diagnosed around 4 years of age. The development of biomarkers to help in earlier, presymptomatic diagnosis could facilitate earlier identification and therefore earlier intervention and may lead to better outcomes, as well as providing information to help better understand the underlying mechanisms of ASD. In this study, magnetic resonance imaging (MRI) scans of infants at high familial risk, from the Infant Brain Imaging Study (IBIS), at 6, 12 and 24 months of age were included in a morphological analysis, fitting a mixed-effects model to Tensor Based Morphometry (TBM) results to obtain voxel-wise growth trajectories. Subjects were grouped by familial risk and clinical diagnosis at 2 years of age. Several regions, including the posterior cingulate gyrus, the cingulum, the fusiform gyrus, and the precentral gyrus, showed a significant effect for the interaction of group and age associated with ASD, either as an increased or a decreased growth rate of the cerebrum. In general, our results showed increased growth rate within white matter with decreased growth rate found mostly in grey matter. Overall, the regions showing increased growth rate were larger and more numerous than those with decreased growth rate. These results detail, at the voxel level, differences in brain growth trajectories in ASD during the first years of life, previously reported in terms of overall brain volume and surface area.",pubmed,0.62094187925238
665,1608,Application of Skeleton Data and Long Short-Term Memory in Action Recognition of Children with Autism Spectrum Disorder.,2021-01-08 00:00:00,,"Sensors (Basel, Switzerland)",E411,,"The recognition of stereotyped action is one of the core diagnostic criteria of Autism Spectrum Disorder (ASD). However, it mainly relies on parent interviews and clinical observations, which lead to a long diagnosis cycle and prevents the ASD children from timely treatment. To speed up the recognition process of stereotyped actions, a method based on skeleton data and Long Short-Term Memory (LSTM) is proposed in this paper. In the first stage of our method, the OpenPose algorithm is used to obtain the initial skeleton data from the video of ASD children. Furthermore, four denoising methods are proposed to eliminate the noise of the initial skeleton data. In the second stage, we track multiple ASD children in the same scene by matching distance between current skeletons and previous skeletons. In the last stage, the neural network based on LSTM is proposed to classify the ASD children's actions. The performed experiments show that our proposed method is effective for ASD children's action recognition. Compared to the previous traditional schemes, our scheme has higher accuracy and is almost non-invasive for ASD children.",pubmed,0.6204556935726874
647,1589,Qualitative evaluation of the Autism Behavior Inventory: use of cognitive interviewing to establish validity of a caregiver report scale for autism spectrum disorder.,2021-01-20 00:00:00,,Health and quality of life outcomes,10.1186/s12955-020-01665-w,,"The Autism Behavior Inventory (ABI) is an observer-reported outcome scale measuring core and associated features of autism spectrum disorder (ASD). Extensive scale development (reported elsewhere) took place, in alignment with the Food and Drug Administration's patient-reported outcome guidance, to address the need for instruments to measure change and severity of ASD symptoms.",pubmed,0.6201656082130099
892,1868,Improving autism and developmental screening and referral in US primary care practices serving Latinos.,2020-09-14 00:00:00,,Autism : the international journal of research and practice,10.1177/1362361320957461,,"Latino children experience delays in access to diagnosis and treatment of autism spectrum disorder. Primary care-based screening of all children for autism spectrum disorder and referring them for services may reduce racial/ethnic differences and improve care. REAL-START, a yearlong screening intervention, was effective in increasing screening for autism spectrum disorder and general developmental delays, increasing therapy referrals, and shortening time for developmental assessment in primary care clinics with Latino patients.",pubmed,0.6189074624457424
835,1804,Assessment of BDNF serum levels as a diagnostic marker in children with autism spectrum disorder.,2020-10-15 00:00:00,,Scientific reports,10.1038/s41598-020-74239-x,,"There has been a significant increase in autism spectrum disorder (ASD) in the last decades that cannot be exclusively attributed to better diagnosis and an increase in the communication of new cases. Patients with ASD often show dysregulation of proteins associated with synaptic plasticity, notably brain-derived neurotrophic factor (BDNF). The objective of the present study was to analyze BDNF serum concentration levels in children with classic forms autism and a healthy control group to determine if there is a correlation between ASD and BDNF serum levels. Forty-nine children with severe classic form of autism, and 37 healthy children were enrolled in the study. Blood samples, from both patients and controls, were collected and BNDF levels from both groups were analyzed. The average BDNF serum concentration level was statistically higher for children with ASD (P < 0.000) compared to the control group. There is little doubt that BDNF plays a role in the pathophysiology of ASD development and evolution, but its brain levels may fluctuate depending on several known and unknown factors. The critical question is not if BDNF levels can be considered a prognostic or diagnostic marker of ASD, but to determine its role in the onset and progression of this disorder.",pubmed,0.6158374284389816
794,1757,Automated identification of postural control for children with autism spectrum disorder using a machine learning approach.,2020-10-24 00:00:00,,Journal of biomechanics,S0021-9290(20)30497-8,,"It is unclear whether postural sway characteristics could be used as diagnostic biomarkers for autism spectrum disorder (ASD). The purpose of this study was to develop and validate an automated identification of postural control patterns in children with ASD using a machine learning approach. 50 children aged 5-12 years old were recruited and assigned into two groups: ASD (n = 25) and typically developing groups (n = 25). Participants were instructed to stand barefoot on two feet and maintain a stationary stance for 20 s during two conditions: (1) eyes open and (2) eyes closed. The center of pressure (COP) data were collected using a force plate. COP variables were computed, including linear displacement, total distance, sway area, and complexity. Six supervised machine learning classifiers were trained to classify the ASD postural control based on these COP variables. All machine learning classifiers successfully identified ASD postural control patterns based on the COP features with high accuracy rates (>0.800). The naïve Bayes method was the optimal means to identify ASD postural control with the highest accuracy rate (0.900), specificity (1.000), precision (1.000), F1 score (0.898) and satisfactory sensitivity (0.826). By increasing the sample size and analyzing more data/features of postural control, a better classification performance would be expected. The use of computer-aided machine learning to assess COP data is efficient, accurate, with minimum human intervention and thus, could benefit the diagnosis of ASD.",pubmed,0.6149722177917467
443,1352,Treatment of insomnia in children and adolescents with autism spectrum disorder.,,,The Lancet. Child & adolescent health,S2352-4642(20)30237-6,,,pubmed,0.6130769366920941
593,1526,Presenting age and features of females diagnosed with autism spectrum disorder.,2021-03-01 00:00:00,,Journal of paediatrics and child health,10.1111/jpc.15417,,"Autism spectrum disorder (ASD) is reportedly more prevalent in males than in females. Hypotheses for this gender imbalance include differing presentations in females. The aim of this study was to identify gender-based ASD differences in age at presentation, clinical features, comorbidities and severity levels.",pubmed,0.6127900694362087
945,1932,Multivariate Neural Connectivity Patterns in Early Infancy Predict Later Autism Symptoms.,2020-06-13 00:00:00,,Biological psychiatry. Cognitive neuroscience and neuroimaging,S2451-9022(20)30140-3,,"Functional brain connectivity is altered in children and adults with autism spectrum disorder (ASD). Functional disruption during infancy could provide earlier markers of ASD, thus providing a crucial opportunity to improve developmental outcomes. Using a whole-brain multivariate approach, we asked whether electroencephalography measures of neural connectivity at 3 months of age predict autism symptoms at 18 months.",pubmed,0.612107595875581
363,1261,Family-Centered Care: How Close Do We Get When Talking to Parents of Children Undergoing Diagnosis for Autism Spectrum Disorders?,2020-11-02 00:00:00,,Journal of autism and developmental disorders,10.1007/s10803-020-04765-0,,"Autism spectrum disorder (ASD) affects 1:59 children, yet little is known about parents' perceptions of family-centered care (FCC) during the diagnostic process leading up to diagnosis. This mixed-methods study explored key elements of FCC from 31 parents of children recently diagnosed with ASD using parallel qualitative and quantitative measures. Parents rated highly their receipt of FCC and discussed ways providers demonstrated FCC. However, the majority of parents indicated that the period when their child was undergoing diagnosis was stressful and reported symptoms of depression and anxiety. The study points to ways in which health care providers can enhance FCC provided to families when a child is undergoing ASD diagnosis.",pubmed,0.6105826677497144
475,1389,Brief Report: Predictors of Teacher-Rated Academic Competence in a Clinic Sample of Children With and Without Autism Spectrum Disorder.,2020-09-04 00:00:00,,Journal of autism and developmental disorders,10.1007/s10803-020-04680-4,,"The rising prevalence of autism spectrum disorder (ASD) necessitates a greater understanding of the academic experience of diagnosed children. The present study investigates several predictors of teacher-reported academic competence among a sample of elementary school children. All children in the sample were referred for an ASD evaluation and approximately half received a diagnosis. Children with and without ASD did not differ on overall academic competence, social skills, or problem behaviors. Regression analyses indicated that cognitive ability, social skills, and problem behaviors accounted for significant variance in academic competence. Moderation analyses indicated that the relations between the predictors and academic competence were comparable for children with and without ASD. Implications and future directions are discussed.",pubmed,0.6094026869560077
595,1529,Autism spectrum disorders and epilepsy in children: A commentary on the occurrence of autism in epilepsy; how it can present differently and the challenges associated with diagnosis.,2021-02-25 00:00:00,,Epilepsy & behavior : E&B,S1525-5050(21)00047-0,,"Autism occurs more frequently in epilepsy, but is often not diagnosed. This could be due to a focus on medical issues, or because it presents differently from classic autism in its timing, phenotype, fluctuating profiles, and high level of comorbidity. Without a diagnosis, these children miss out on interventions that could modify outcome and their families and local teams will struggle to understand and support them. They also become a hidden group that does not participate in or benefit from research. This paper examined the issues and challenges of diagnosing autism in a population with a high-risk of epilepsy, drawing on more than 20 years' experience of a specialist multi-disciplinary Developmental Epilepsy Clinic (DEC).",pubmed,0.6088920971992409
322,1212,The Urine Metabolome of Young Autistic Children Correlates with Their Clinical Profile Severity.,2020-11-23 00:00:00,,Metabolites,E476,,"Autism diagnosis is moving from the identification of common inherited genetic variants to a systems biology approach. The aims of the study were to explore metabolic perturbations in autism, to investigate whether the severity of autism core symptoms may be associated with specific metabolic signatures; and to examine whether the urine metabolome discriminates severe from mild-to-moderate restricted, repetitive, and stereotyped behaviors. We enrolled 57 children aged 2-11 years; thirty-one with idiopathic autism and twenty-six neurotypical (NT), matched for age and ethnicity. The urine metabolome was investigated by gas chromatography-mass spectrometry (GC-MS). The urinary metabolome of autistic children was largely distinguishable from that of NT children; food selectivity induced further significant metabolic differences. Severe autism spectrum disorder core deficits were marked by high levels of metabolites resulting from diet, gut dysbiosis, oxidative stress, tryptophan metabolism, mitochondrial dysfunction. The hierarchical clustering algorithm generated two metabolic clusters in autistic children: 85-90% of children with mild-to-moderate abnormal behaviors fell in cluster II. Our results open up new perspectives for the more general understanding of the correlation between the clinical phenotype of autistic children and their urine metabolome. Adipic acid, palmitic acid, and 3-(3-hydroxyphenyl)-3-hydroxypropanoic acid can be proposed as candidate biomarkers of autism severity.",pubmed,0.6088336209309141
482,1399,Investigating electroencephalography signals of autism spectrum disorder (ASD) using Higuchi Fractal Dimension.,2020-08-31 00:00:00,,Biomedizinische Technik. Biomedical engineering,10.1515/bmt-2019-0313,,"Autism spectrum disorder (ASD) is a neurodevelopmental disorder with a deficit of social relationships, interaction, sense of imagination, and constrained interests. Early diagnosis of ASD will aid in devising appropriate training procedures and placing those children in the normal stream. The objective of this research is to analyze the brain response for auditory/visual stimuli in Typically Developing (TD) and children with autism through electroencephalography (EEG). Brain dynamics in the EEG signal can be analyzed well with the help of nonlinear feature primitives. Recent research reveals that, application of fractal-based techniques proves to be effective to estimate of degree of nonlinearity in a signal. This research attempts to analyze the effect of brain dynamics with Higuchi Fractal Dimension (HFD). Also, the performance of the fractal based techniques depends on the selection of proper hyper-parameters involved in it. One of the key parameters involved in computation of HFD is the time interval parameter 'k'. Most of the researches arbitrarily fixes the value of 'k' in the range of all channels. This research proposes an algorithm to estimate the optimal value of the time parameter for each channel. Sub-band analysis was also carried out for the responding channels. Statistical analysis on the experimental reveals that a difference of 30% was observed between autistic and Typically Developing children.",pubmed,0.6085651207395699
987,1978,"A systematic review evaluating the implementation of technologies to assess, monitor and treat neurodevelopmental disorders: A map of the current evidence.",2020-06-01 00:00:00,,Clinical psychology review,S0272-7358(20)30058-1,,"Technology-based interventions provide an attractive option for improving service provision for neurodevelopmental disorders (NDD), for example, widening access to interventions, objective assessment, and monitoring; however, it is unclear whether there is sufficient evidence to support their use in clinical settings. This review provides an evidence map describing how technology is implemented in the assessment/diagnosis and monitoring/ treatment of NDD (Prospero CRD42018091156). Using predefined search terms in six databases, 7982 articles were identified, 808 full-texts were screened, resulting in 47 included papers. These studies were appraised and synthesised according to the following outcomes of interest: effectiveness (clinical effectiveness/ service delivery efficiencies), economic impact, and user impact (acceptability/ feasibility). The findings describe how technology is currently being utilised clinically, highlights gaps in knowledge, and discusses future research needs. Technology has been used to facilitate assessment and treatment across multiple NDD, especially Autism Spectrum (ASD) and attention-deficit/hyperactivity (ADHD) disorders. Technologies include mobile apps/tablets, robots, gaming, computerised tests, videos, and virtual reality. The outcomes presented largely focus on the clinical effectiveness of the technology, with approximately half the papers demonstrating some degree of effectiveness, however, the methodological quality of many studies is limited. Further research should focus on randomised controlled trial designs with longer follow-up periods, incorporating an economic evaluation, as well as qualitative studies including process evaluations and user impact.",pubmed,0.6077793705185228
688,1634,Perinatal and Obstetric Predictors for Autism Spectrum Disorder.,2021-01-01 00:00:00,,Journal of autism and developmental disorders,10.1007/s10803-020-04846-0,,"The objective is to identify obstetric and perinatal factors that could be significant predictors of ASD and may lead to early detection and intervention. A population-based case-control study including 128 children diagnosed with ASD and 311 controls was conducted. Information was collected through self-reported questionnaires. The factors retained as significant predictors for ASD in the final adjusted hierarchical logistic regression model were cesarean section and male gender. The study revealed a higher incidence of cesarean sections and male gender in children with ASD in comparison to unaffected children confirming the results of previous studies. Children born by cesarean section, especially males, should be more closely monitored for the presence of ASD traits for early diagnosis and intervention.",pubmed,0.6066456978021998
499,1418,Injuries in children and adolescents with psychiatric disorders.,2020-08-24 00:00:00,,BMC public health,10.1186/s12889-020-09283-3,,"Unintentional injuries are a leading cause of morbidity and mortality in children of all ages. Prevention strategies require knowledge of risk factors, and behavior and psychiatric disorders have been suggested to influence the risk of injury during childhood. While externalizing disorders have been found to increase the risk for injuries, results are mixed regarding internalizing disorders, such as affective and anxiety conditions, and Autism Spectrum Disorders (ASD). There is a need for large scale studies relying on robust data sources. The aim of the present study was to examine the association between psychiatric disorders and injuries requiring medical attention, in a large population-based cohort of 350,000 children and adolescents in Sweden.",pubmed,0.6059654809735565
846,1816,Association of Anemia with Neurodevelopmental Disorders in a Nationally Representative Sample of US Children.,2020-10-07 00:00:00,,The Journal of pediatrics,S0022-3476(20)31172-0,,"To examine the associations of anemia with autism spectrum disorder (ASD), attention deficit hyperactivity disorder (ADHD), and learning disability in US children.",pubmed,0.6054466109660493
342,1234,Cognitive behavioural therapy for anxiety disorders in children and adolescents.,2020-11-16 00:00:00,,The Cochrane database of systematic reviews,10.1002/14651858.CD013162.pub2,,"Previous Cochrane Reviews have shown that cognitive behavioural therapy (CBT) is effective in treating childhood anxiety disorders. However, questions remain regarding the following: up-to-date evidence of the relative efficacy and acceptability of CBT compared to waiting lists/no treatment, treatment as usual, attention controls, and alternative treatments; benefits across a range of outcomes; longer-term effects; outcomes for different delivery formats; and amongst children with autism spectrum disorders (ASD) and children with intellectual impairments.",pubmed,0.6051712850754002
705,1651,Age of walking and intellectual ability in autism spectrum disorder and other neurodevelopmental disorders: a population-based study.,2020-12-28 00:00:00,,"Journal of child psychology and psychiatry, and allied disciplines",10.1111/jcpp.13369,,Delayed walking is common in intellectual disability (ID) but may be less common when ID occurs with autism spectrum disorder (ASD). Previous studies examining this were limited by reliance on clinical samples and exclusion of children with severe motor deficits.,pubmed,0.6048238959478757
138,1005,Protein Biomarkers of Autism Spectrum Disorder Identified by Computational and Experimental Methods.,2021-02-25 00:00:00,,Frontiers in psychiatry,10.3389/fpsyt.2021.554621,,"<b>Background:</b> Autism spectrum disorder (ASD) is a complex neurodevelopmental disorder that affects millions of people worldwide. However, there are currently no reliable biomarkers for ASD diagnosis. <b>Materials and Methods:</b> The strategy of computational prediction combined with experimental verification was used to identify blood protein biomarkers for ASD. First, brain tissue-based transcriptome data of ASD were collected from Gene Expression Omnibus database and analyzed to find ASD-related genes by bioinformatics method of significance analysis of microarrays. Then, a prediction program of blood-secretory proteins was applied on these genes to predict ASD-related proteins in blood. Furthermore, ELISA was used to verify these proteins in plasma samples of ASD patients. <b>Results:</b> A total of 364 genes were identified differentially expressed in brain tissue of ASD, among which 59 genes were predicted to encode ASD-related blood-secretory proteins. After functional analysis and literature survey, six proteins were chosen for experimental verification and five were successfully validated. Receiver operating characteristic curve analyses showed that the area under the curve of SLC25A12, LIMK1, and RARS was larger than 0.85, indicating that they are more powerful in discriminating ASD cases from controls. <b>Conclusion:</b> SLC25A12, LIMK1, and RARS might serve as new potential blood protein biomarkers for ASD. Our findings provide new insights into the pathogenesis and diagnosis of ASD.",pubmed,0.604812467948371
